comment,date,writer_name,movie_name,rating
"This is a magical film, literally poetic. Magic surrounds the introspective bus driver and his wife. They live in a community thriving in the shadow of the great American poet William Carlos Williams. Everyone seems to be a quiet poet of one sort or another. The bus driver protagonist scribbles perpetually refined notes in a notebook, his secret notebook. We are reminded later of how much this resembles a school girl with her diary. Yet he resembles others in that everyone in town seems to be refining his own feelings in black and white. His wife, lovingly devoted to him, his writings, and their home, is a piece of poetry herself as she decorates their home in seemingly endless exploration and rediscovery of that basic black and white contrast. If you need a lot of racket to appreciate a film, watch Transformers again. But if you appreciate purity, reflection, and poetry, which can occur so rarely in American film, you will find this a five star film.","June 26, 2017",William,Paterson (4K UHD),4.0
I didn't knew that this was a remake of the German film and honestly I don't care that much.,"March 19, 2016",Hee Chul Kwon,Barefoot,5.0
"There are so many ape/gorilla movies out there, its hard to tell the players without a scorecard. For most part - if you watch just once you might get a small buzz off of action/scenery etc. After that forget it. It beats counting the frogs jumping in your swimming pool (or something like that). The folks did best job expected with such a lame plot - but who cares when there's plenty of popcorn to go around - you get my drift. Sit back and relax -","July 4, 2017",Inquiring Minds,Congo,3.0
"DENZEL!!. What a great actor! Denzel really immerses himself in his role and gives a tremendous performance in this action drama. I am surprised I missed this movie when it was released years ago. There is good dialogue, beautiful actresses, and much mystery and intrigue. Denzel's characters are not always the best role models and this movie is another example of this as he gets mixed up in a murder mystery and sexual exploits. What makes this movie so good is how his character stays one step ahead as he weaves himself in and out of trouble in clever ways. There are many twists and turns keeping the audience in suspense and rooting for the characters. The writing is very good with characters displaying great emotion, wit, humor, and ""believability"" in their roles. They also have a great rapport with each other whether they are on the same side or pitted against one another. Overall, this is a very enjoyable action movie that I definitely recommend","October 8, 2017",RH,Out of Time,4.0
"I’ve watched this movie five times since I got it on DVD, and I still don’t know what it’s about. Now, you’d think a horror movie called “The Haunting of Hell House” would center on a haunted house, but this movie doesn’t focus on any one person or location like a good haunted house movie would. Based on a story by playwright Henry James, the movie stars actor Andrew Bowen as New England college student James Farrow whose wife, maybe girlfriend, dies due to a botched abortion, and he begins to see her in dreams and hallucinations. He is soon drawn to the empty house they once explored in their youth, but now, it turns out that it belongs to a Professor Ambrose, played by the talented Michael York from the British stage. Farrow pursues York’s help to rid himself of the ghost he believes is haunting him and scratching him up, but whether it’s in his mind or just his guilt is never explained. Meanwhile, Ambrose is similarly being haunted by the ghost of his dead wife who refuses to let him sell the house. Neither man believes the ghost of the other one exists. Meanwhile, Farrow is being hunted by the police for his dead girlfriend found in his apartment. He escapes to Ambrose for protection, but the old man is dying and can’t help him. Farrow flees to the house to ask for forgiveness from his girlfriend’s ghost, but discovers Ambrose’s ghost isn’t real after all. It turns out he’s being systemically poisoned by his angry daughter and Farrow drinks the poisoned wine from her for her father to be with his bride. In the end, Farrow dies in jail next to the phony doctor who botched his girlfriend’s abortion. Is this a good movie? Uh, no. It’s long, it drags on, it’s confusing and the name of the movie is misleading. This is not a haunted house movie. This isn’t even a horror movie, and trying to make it look like one may be its worse trait. However, it does have some beautiful scenery for what I speculate is supposed to be Turn-of-the-Century New England. Overall, it’s not exactly a movie that can live up to the hype of its name.","August 17, 2015",Fred Adelman,The Haunting Of Hell House,2.0
