comment,date,writer_name,movie_name,rating
I will not tell you the plot as others have already done that with too much detail. I will offer my review of the movie and answer some of the criticisms of other reviewers.,"August 2, 2018",Kim Hoag,Leave No Trace,5.0
I love making furniture and when the mom brings dinner from stove top to right on top of the unprotected wood finish without hesitation shows this lady is areal winner meaning most people who understand craftsmanship and elbow grease cringe when some idiot burns the top of the kitchen table  or your wife's friend throws her big crappy bag on your cars paint job then slides it off so it scratches right across and when you say something she gets all butt hurt and your wife tells you say's your mean because you told the overweight always got something in her mouth eating diabetes having stretch pants wearing slob got a tank top on and a mouse tattoo on her neck dang sorry to rant I get upset when stuff get ruined I guess......HAHAHAHAHAHAHAHAPUT THE POT ON A COASTER DUMMY!,"May 7, 2019",wylie,Killers Within,3.0
"The original, worth keeping my VCRs going.  This film may seem quaint today, but I prefer it to the remake.  It is an original. Plus it features two stars just starting out, Matthew Broderick and Ally Sheedy.  This was released on VHS in1983, and besides watching the stars grow up and move on, I, like so many others are surprised and disappointed to find that after forty years, we've not moved much involving macro technology.  I purchased this 'Used. Very good'.  The only thing missing is the plastic wrapper. Thanks Amazon, this is in excellent condition, even the case. Well worth it, even if it didn't qualify for prime (LOL).","August 1, 2017",Donna Swiniuch,WarGames,5.0
"My Wife and I enjoyed this film and both got a lot of laughs while watching. All the actors, especially Mel Gibson, were great.  We both agreed it was better than the first one with the addition of the fathers (or grandfathers).","November 16, 2018",PawPawRon,Daddy's Home 2,5.0
Give it a chance. Watch it.,"November 4, 2018",Juan Hernandez Jr.,Lost Fare,5.0
"I have mixed feelings on the movie.  For one thing, they never explained what brought about the apocalypse.  Nor a time frame for the gangs to get to where they were.  But it put forth a future that was very brutal, and in this movie, there is no shortage of blood.  And early on, they fall back on the cliche that if you tell the gang member what they want to know, you will live.  One clear mistake I noticed is when the shot went through the windshield to hit Nina, she had a bloody shoulder wound, but there was blood on the windshield where the bullet went through, which makes no sense.  But other than that, the movie was tight.  Mark and Nina are the central characters, other than Betsy, and their marriage is not that great.  It is Nina that undergoes the change during their journey.  Nina will really annoy a person for nearly the first half of the movie.  The radio voice really added to the movie, and the voice reminded me of Rush, although the language is VERY salty.  The movie was slow at times and Mark and Nina did some really stupid things so they were flawed individuals.  The gangs have a element of Mad Max about them.  And the movie portrays that society is really bottom feeding, and very grimy.  Nathan and Theresa were perhaps the two most noble characters in the entire movie.  In all a solid movie, but breaking no new ground.","May 25, 2019",Avid reader,The Domestics,4.0
Just say no,"December 29, 2018",Kindle Customer,Hereditary (4K UHD),1.0
"This certainly came as a surprise. After watching the first All Hallows Eve I had what I consider to be reasonable expectations for the sequel. The first movie was fantastic and I wouldn't mind watching it again. However, the sequel not only drops the ball but also feels like a lazy slap to the face.","May 5, 2019",Patrick L James,All Hallows' Eve 2,1.0
"This is not typical Keanu Reeves in Hollywood fodder.  A diamond dealer of the black market sort, Keanu gets betrayed by a partner while falling in love with a sensitive Russian cafe' owner, Katya.  The story intertwines between Katya and Keanu and the Russian mafia, and comes to a dark conclusion, but with a powerful statement by the character played by Keanu.  Recommended for intelligent minds, not action seekers.","December 2, 2018",trumpsahead,Siberia (2018),4.0
"How have I not seen this movie before?? Great classic lawyer drama, helmed by Richard Gere in his prime - and really, who can top that..? I'll admit, I'd have watched it just to look at him for 2 hours. Thought I had the twist figured out, but the bank shot at the end got me - and I love to be got. 😉","March 11, 2017",M. Ackermann,Primal Fear,5.0
I'm amused to see 3 and 4 star ratings from people who've watched it multiple times.,"October 30, 2017","Thomas G. Field, Jr.",Indecent Proposal,5.0
not cliche at all. deep and rich. many layers for you to feel and ponder on.,"May 24, 2019",Y. Guo,The Accused,5.0
"I don't know what the high ratings are about. This is a typical revenge film caste in the theme of mothers who have lost their sons and daughters to gang rated violence. The character development left me not bonding to any of the characters, and the plot was thin, underdeveloped, anticlimactic, and in some ways, fairly unbelievable too. It was worth 3 stars, but only because of the acting and filming, which was top notch.","May 26, 2017",NULL,Lila and Eve,3.0
It is exactly as advertised.,"August 1, 2013",Walter Marx,Soul Plane,3.0
"I find it implausible that anyone who went through an ordeal such as the one portrayed in this fictional dramatization would volunteer to relive it on film. Even if this is partially factual, the acting is more painful than the storyline. Plus, it is not fair to the actual victims being kidnapped through no fault of their own to be compared with those who knowingly put themselves at risk by doing idiotic things like going to modeling session with some random dude who hit on you in public. If people were not so self absorbed the rate of adult sex trade kidnappings would decrease considerably in a very short time. In short, don't do stupid things because of your vanity.","May 3, 2019",Mimi G,Apartment 407,1.0
"Reading some of the reviews, and a few people had a problem with the religious aspect of the movie. Let me just say, as an atheist, that the religious aspect isn't the point of the movie. Is it so bad that many people in real life have a religious belief? To me, the more important message was the faith in our fellow human beings that when confronted with such atrocity as human sex trafficking and forced prostitution, that there are those that would stand up and make a choice to help the women who are caught in this horrific situation, and if faith in a God is what helps them find the strength, then what is wrong with that?","December 19, 2017",Andrew Clark,Priceless,5.0
"Based on the cover art and the low IMDB score, I threw this on as background noise while I did stuff at my desk, which is what I do with schlocky horror movies. To my surprise, I found myself watching the movie more than I was doing my other stuff. I was expecting low-budget ridiculousness, but it was a good story, if unremarkable, I felt invested in the characters, and I was impressed at the overall production quality, especially the acting and direction. Recommended!","August 30, 2017",Anon,The Wicked,4.0
I have watch all the Madea movies. Tyler Perry does a great job writing the madea series.  I can't wait to see what madea movie he is coming up with. His Madea Halloween movies are funny.,"January 30, 2018",Erin S.,Tyler Perry's Boo! 2 A Madea Halloween,5.0
"Frieda Ferrell the actress portrays herself in what she claims to be a true story.  However, it is not a true story.  Frieda Ferrell was a model before the alleged incident, not a Pilates instructor.  The alleged event happened in London, not the US.  She did not have a daughter.  She was allegedly held for three days.  After her alleged escape, she waited several days to contact the police and she never contacted her boyfriend at the time again.  The police apparently found her story implausible, although they did investigate.  Of course her alleged captor never apprehended.  The police have not corroborated her story or commented on the case.  While it is important to believe people when they report crimes, it is also important to require evidence and corroboration and not believe every story you hear, especially when the story is presented in a way that seems to be more for the purpose of advancing your career rather than stopping and punishing terrible crimes.  The movie itself is a piece of trash, even as a horror thriller, with no psychological tension.","February 20, 2019",Shakti Skye,Apartment 407,1.0
"This one maybe low budget, but it was WICKED, & CREEPY. I loved it, so make the Pop Corn, and enjoy. The REVIEWS don't give it justice to give it fairness, it's to each it's own. Give it fair-play!!!!!!","September 12, 2016",Amazon Customer,3: All Hallows Eve,5.0
"First and foremost, Richard Gere is so damn charming with that look and that smile, I was already knee deep before I knew what the movie was even about.  The plot was great and I didn't want it to end! That never happens to me.  They had me start to finish.  Bravo","March 6, 2017",K. Byrne,Primal Fear,5.0
- A good story with a just ending -,"July 27, 2018",Elle Shopper Lady,Double Jeopardy (1999),4.0
"Overall, this is a very enjoyable DVD, although it wasn't quite enough, but then, who can get enough of 1D? I'm 60 years old, but I think these boys are chock full of talent, and I love them all, with Louis and Harry being my favorites. I wish it had gone more into the personal lives of the boys, and maybe more songs too, but overall I think it is worth the purchase. I'm glad I decided to buy it.","May 4, 2016",Randi C. Holbrook,One Direction: This Is Us (Extended Cut),4.0
"I bought this only for Cadillac Man. I loved how Robin William's character Joey was just a regular guy who took control of a dangerous situation. Joey worked for a used car lot and Tim Robbin's character Larry comes in a takes everyone hostage because he is worried that his wife who works there is cheating on him. Larry is not a very good hostage taker and Joey has to tell him how to be a hostage taker. Joey has made mistakes in his life too so that helps him understand and help Larry. The movie shows how everyone can get in trouble sometimes but that doesn't make them a bad person. Even though it is a hostage situation, it is not scary. It is actually a comedy. If you are a Robin Williams fan and want to take a look at his earlier work, this is a fun movie to watch.","October 5, 2014",Jolene Wipf,Cadillac Man,5.0
"Not generally my kind of movie, bought it for the wife. But, I have to admit, I really enjoyed it. I have always liked Queen Latifah Movies, they have a certain comedic element to them that brings me back to classic comedy. Beauty Shop delivers in so many ways.  This movie boasts a number of stars including Kevin Bacon. In this Bacon is the man you love to hate, right from the start and Latifah is the woman who is the little guy who has to rise to the level of the competitive business she wants to be in. The movie will have you laughing from start to finish. I highly recommend it to anyone who likes to laugh, and doubly so to anyone who likes Queen Latifah.","June 21, 2017",Rodney C Walmer,Beauty Shop,5.0
"I don't understand how the top critical review didn't grab this person. The movie is a very touching movie. I guess some people in this world don't get the true meaning of love. It grabbed me and I embraced it. Bravo for the Actors, Writers and Producers. For the pooh pooh people has someone ever touched you life like this movie and eventually you gave in to the love? If not I really feel sorry for you. I have that kind of Love with my husband now over thirty years now and part of the movie really touched me. When the Dad was explaining how he cheated on his wife and how he told her right away. I did that with my husband thirty years ago and I told my boyfriend right away who is now my husband. I guess some people like myself have a conscious and was scared and not quite sure of what I was getting into but at least I had the balls to say it and I was lucky enough to have married that boyfriend who forgave me. Life lessons are in this movie and True Love was shown. I know this review has nothing to do about the movie but when it comes down to it Love comes in all colors shapes sizes and The Big Sick showed it and I loved how it showed it I am also glad that it was based on a true story. So again if you want to really see a good movie about Love take a two hours out of you life and feel it. Because I sure did. Thank You Amazon for making this movie I hope the critical reviewers get to feel this kind of Love someday every being deserves that feeling.","November 24, 2017",Mushroomie,The Big Sick,5.0
"Uncreative title, bland movie jacket, never heard of it - expectations were running low. But...ZING: great movie. Despite its romcom overlay, it's quite a profound examination of the complexities of friendship, loneliness, uncertainty, ambition, joy, love. In short, it's an insightful look at this wacky journey called ""life."" I particularly like the fact there are no ""bad"" guys - just a bunch of young adults making their way through life as best they can, and making a go of it in the end. And as a bonus? Some very funny lines.","December 26, 2017",laurie,What If,5.0
"A wonderful film about a girl's senior year in Catholic school, her first serious boyfriend and her dreams of moving far away to attend college. It is all realistic from the way she longs to be in NY rather than the boring town she grew up in to her very realistic mother/daughter relationship that is frustrating sometimes and loving too. She is embarrassed by her parents and the fact that she isn't one of the rich girls. She buddies up with kids that seem very intelligent and unique only to discover they are just pretentious. It might be the most true mother/ daughter relationship I have ever seen in a film. The writing is excellent. I hate films with teenagers who all talk like adults in a Woody Allen film. The teens here speak realistically for their age. The acting is excellent. Both Saoirse Ronan and Lori Metcalf are perfect in their roles. Highly recommended.","March 27, 2018",M. Mara,Lady Bird,5.0
"The description says and I quote, ""a solitary janitor whose life is transformed after he becomes the guardian of his 16 yr old nephew."" Spoiler alert: his life is NOT transformed, he is the same as when he started. Two hours of my life I will not get back, I kept hoping for something to redeem this movie but there is none. For those saying this is ""real life"", two things, one I don't watch movies for real life, I watch to be moved, to be inspired,  to be uplifted. And two, real life is actually not as bad as this movie was, this isn't ""real life"", this is ""worst case scenario"" no hope garbage.","August 31, 2018",T. Travis,Manchester By The Sea,1.0
"“ROAD HOUSE"" This is THE iconic cult classic movie that won 4 Oscars in 1989.  Patrick Swayze and Sam Elliott are at their heroic kickass best.  The great supporting cast headed by a sadistic Ben Gazzara as the tyrannical smug landowner is perfect; as is Kevin Tighe's white-haired dignified club owner, and the smartly sexy Kelly Lynch.  Add a motley group of bar dwellers that can never again be duplicated, and you have a vintage action-packed epic movie.","April 2, 2018",S. J. VOLK,Road House,5.0
"In case you can't tell from the title, cover, trailer, blurb, etc., this is a sh!ts and giggles gun fight movie. That's it. No before, no after, no major plot, just a lot of good actors who rolled around in the 70s section of the wardrobe dept,  loaded up on guns and met up in a warehouse full of charges for no good reason. In that way, its absolutely fantastic.","January 13, 2018",Shannon Nikic,Free Fire,4.0
"So maybe this isn't a five star film.. probably not for most.  I, on the other hand love a good unsolicited laugh, and I'm no pushover for a laugh..  This movie is really funny, with an obvious all star cast who seem to have made this film out of the love for the story.. great cameo's and small role players.  I would never give anything away, I just say if you need a break from the norm, and want a smile on your face.. give this gem a shot..","June 2, 2018",Shallow Graves,The Disaster Artist,5.0
"If you thought Martin Scorsese would go into his twilight years resting on past successes this film will make you think again.  ""Silence"" is a film of immense power and depth that will make one examine your long held beliefs.  Scorsese posits here the idea that it is much easier to sacrifice oneself for your faith but is it conscionable to sacrifice others for your convictions?  This is not an easy film to watch but compelling nonetheless.  When the film concludes its title garners meaning and resonance.  Enough cannot be said about Andrew Garfield as Father Rodrigues, an idealistic missionary sent to feudal Japan to investigate claims of persecution against Christians.  I couldn't help but contrast his work here to his equally fine performance in Mel Gibson's ""Hacksaw Ridge""  as Desmond Doss, a religious conscientious objector who served valiantly as a medic in the Pacific Theatre during World War II.  Both characters find their faith tested who ultimately make fateful choices.  Liam Neeson is terrific as Father Ferrera the enigmatic mentor of Rodrigues who preceded him to Japan whose choices ultimately influence the younger cleric.  The film leaves you asking yourself what would you do if confronted with a gut wrenching choice and life leaves no easy answers.","April 9, 2017",David E. Baldwin,Silence,5.0
"If Richard Flarerty was only the shortest man to ever be in the US Army and A Green Beret that would certainly be a unique story in itself.  Flarety was much more though.  He was a bonafide war hero and beloved leader of the men he commanded.  A small stature with a oversized shadow.  Yet he was cut from the Army that was his life after two tours in Vietnam.  This story documents as much as can be known about a man whose post army life was spent in a variety of jobs freelancing and alternating between classified missions conducted by the CIA and NSA.  Eventually he ended up with a mundane Postal Service job which he hated and after some years walked away from.  This is when he began his homeless period.  It would seem farfetched of course but much of Richard Flarertys life could be summed up as such.  What an interesting man and totally unique story.  I think the movie does a great job of shedding some light into this hero who preferred dangerous work over the everyday.  Obviously for a man who preferred to remain mostly obscure there must be so much more, but what's here hits some strong points and gives a nice memorial to a forgotten hero.  I was fascinated by this documentary and recommend it to anyone slightly interested.","March 28, 2019",John Werner,The Giant Killer,4.0
"Fantastic movie! Absolutely loved it that Daniel Craig was playing opposite of his usual suave James Bond character. It is a quirky movie that some might consider to be slow, however I thought it was very clever and funny. Enjoyed the heck out of it!","January 25, 2018",Starlene L. Grochowicz,Logan Lucky,5.0
"I was one of the hundreds of part-time after work women's liberation feminist era organizers (of speak-outs, conferences, rallies, newsletters, women's center efforts) and was heartened by the photographs, film clips and interviews that showed groups of women working together throughout the film as those best depict the momentum of the times. I disagree with one of the last statements that radicals were all so necessary for the changes we were able to accomplish. Radicals as we generally think about them might  talk and write and sometimes teach at universities and these days tweet and FB post. Instead most of the ""radicals"" Ms. Ceballos refers to for the Miss America demonstration were just middle road  young women participating in protests many young people did at the time. However, it was hundreds and thousands of women in the middle who stepped up and out to make REAL change happen back then and in recent years, the same women responsible for the upcoming very possible election of the first woman president of the United States.Also many if not most of us were aware of the efforts of early feminists as most women's liberation anthologies included essays about them.","July 6, 2016",Lynne Shapiro,She's Beautiful When She's Angry,4.0
"Maybe I'm a sucker for heist movies with comedic and human elements, but I loved this both times I've seen it.","July 16, 2018",Justin Moore,Logan Lucky,5.0
"If you thought Martin Scorsese would go into his twilight years resting on past successes this film will make you think again.  ""Silence"" is a film of immense power and depth that will make one examine your long held beliefs.  Scorsese posits here the idea that it is much easier to sacrifice oneself for your faith but is it conscionable to sacrifice others for your convictions?  This is not an easy film to watch but compelling nonetheless.  When the film concludes its title garners meaning and resonance.  Enough cannot be said about Andrew Garfield as Father Rodrigues, an idealistic missionary sent to feudal Japan to investigate claims of persecution against Christians.  I couldn't help but contrast his work here to his equally fine performance in Mel Gibson's ""Hacksaw Ridge""  as Desmond Doss, a religious conscientious objector who served valiantly as a medic in the Pacific Theatre during World War II.  Both characters find their faith tested who ultimately make fateful choices.  Liam Neeson is terrific as Father Ferrera the enigmatic mentor of Rodrigues who preceded him to Japan whose choices ultimately influence the younger cleric.  The film leaves you asking yourself what would you do if confronted with a gut wrenching choice and life leaves no easy answers.","April 9, 2017",David E. Baldwin,Silence,5.0
This movie is not for those who are offended by curse words or violence or social/political incorrectness.,"January 3, 2016",Amazon Customer,Seven Psychopaths,5.0
"If you thought Martin Scorsese would go into his twilight years resting on past successes this film will make you think again.  ""Silence"" is a film of immense power and depth that will make one examine your long held beliefs.  Scorsese posits here the idea that it is much easier to sacrifice oneself for your faith but is it conscionable to sacrifice others for your convictions?  This is not an easy film to watch but compelling nonetheless.  When the film concludes its title garners meaning and resonance.  Enough cannot be said about Andrew Garfield as Father Rodrigues, an idealistic missionary sent to feudal Japan to investigate claims of persecution against Christians.  I couldn't help but contrast his work here to his equally fine performance in Mel Gibson's ""Hacksaw Ridge""  as Desmond Doss, a religious conscientious objector who served valiantly as a medic in the Pacific Theatre during World War II.  Both characters find their faith tested who ultimately make fateful choices.  Liam Neeson is terrific as Father Ferrera the enigmatic mentor of Rodrigues who preceded him to Japan whose choices ultimately influence the younger cleric.  The film leaves you asking yourself what would you do if confronted with a gut wrenching choice and life leaves no easy answers.","April 9, 2017",David E. Baldwin,Silence,5.0
"Surprise movie of the year, I think.  Went in knowing nothing, laughed throughout.  Oceans 11 and O Brother Where Art Thou blended.  Well acted, well cast.  Was the first movie from the stack we watched Christmas morning--my wife insisted!","January 4, 2018",T.Snyder,Logan Lucky,5.0
"If you thought Martin Scorsese would go into his twilight years resting on past successes this film will make you think again.  ""Silence"" is a film of immense power and depth that will make one examine your long held beliefs.  Scorsese posits here the idea that it is much easier to sacrifice oneself for your faith but is it conscionable to sacrifice others for your convictions?  This is not an easy film to watch but compelling nonetheless.  When the film concludes its title garners meaning and resonance.  Enough cannot be said about Andrew Garfield as Father Rodrigues, an idealistic missionary sent to feudal Japan to investigate claims of persecution against Christians.  I couldn't help but contrast his work here to his equally fine performance in Mel Gibson's ""Hacksaw Ridge""  as Desmond Doss, a religious conscientious objector who served valiantly as a medic in the Pacific Theatre during World War II.  Both characters find their faith tested who ultimately make fateful choices.  Liam Neeson is terrific as Father Ferrera the enigmatic mentor of Rodrigues who preceded him to Japan whose choices ultimately influence the younger cleric.  The film leaves you asking yourself what would you do if confronted with a gut wrenching choice and life leaves no easy answers.","April 9, 2017",David E. Baldwin,Silence,5.0
