comment,date,writer_name,movie_name,rating
"Maaaaan! Even after knowing the ending, I still fell for it. Ed Norton is so good in this and the case so compelling it's mesmerizing.","January 2, 2018",leo,Primal Fear,5.0
"It was refreshing to see Robert Redford play an off-type, somewhat 'snarky' character. He's still as good looking as ever, but he also seemed too old to be playing this role. Especially considering that Demi was so much younger. This made it appear as if he wanted her as another object for his collection. Demi Moore was at the height of her acting career, however; I think she could have brought more depth to her character.  Woody Harrelson did very well in one of his first dramatic roles. I could sense the anguish and anger that would come about had this been real.","March 22, 2016",Violet,Indecent Proposal,4.0
"There is a reason Jodi Foster is a favorite actress of mine she is just the best. I'll watch anything she is in. The silence of the Lambs book did not make any stars with me, but I recommend the movie with her in it. She shines here and Kelly McGillis does well also in taking on drinking, young ""I do it because I can"" young punks, coverups, and rape with victim blaming. This actually happens way too many times in real life. All that someone like her has to endure by mockers, the boys she is trying to put away and those siding with them and the control they have over those who should say something but for many reasons are afraid of the repercussions.  This is an ""on the edge of the seat"" movie. I felt the frustration and fear of the protagonist throughout. I cried in the end for the verdict with Sara and I believe it was based on a true story.  Recommended.","May 26, 2019",Karen L. Dunleavy,The Accused,5.0
"I don't know what the high ratings are about. This is a typical revenge film caste in the theme of mothers who have lost their sons and daughters to gang rated violence. The character development left me not bonding to any of the characters, and the plot was thin, underdeveloped, anticlimactic, and in some ways, fairly unbelievable too. It was worth 3 stars, but only because of the acting and filming, which was top notch.","May 26, 2017",NULL,Lila and Eve,3.0
"Worst ""blackslpoitation"" movie ever. Every black stereotype imaginable, mixed with a stupid plot line, and terrible acting. Oh and a few laughs. All in all an incredible waste of time and money. The black community should be outraged yet again.","April 19, 2015",HillJack Senior,Soul Plane,1.0
This movie is very disturbing and hard to watch at times. The acting is extremely good. Isabel was fantastic in her role. This movie is highly recommended.,"December 3, 2018",blondie,Apartment 407,5.0
"I consider myself a fairly new fan of Donald Glover (Childish Gambino), and seeing this really makes me know why I am. He is a very talented individual who knows his stuff. For veteran fans, you already know who he is all about. For newcomers, I hope this music touches your soul and you continue to listen to his music. Very talented person.","April 13, 2019",Deano,Guava Island,5.0
"This movie is a lovely portrait of a father/daughter relationship, the perils of PTSD that many of our veterans face, and the beauty of a small community that takes care of others. Honestly one of the best films I've seen in years.","November 24, 2018",Monika Matthews,Leave No Trace,5.0
It was something different and at least it didn't look like somebody made in their backyard with their I-Phone,"May 4, 2019",Nancy E.,Killers Within,4.0
"This is the best zombie movie of them all. Of course, I don't really consider it a ""zombie movie"" in the sense that zombie movies are usually horror movies. To me, this is more akin to a guy's romantic comedy with some action scenes added on (perhaps that's a redundant description). The dialogue is excellent. The concept is fantastic. I love this movie.","May 5, 2017",Iamme,Zombieland,5.0
"The first movie was really well done - tight, funny, with a lot of heart. This movie was a mess, and I wanted to dislike it for that reason. Yet my wife and I were wailing in laughter throughout it, and by the sentimental, patently ridiculous ending, I was smiling ear to ear. Sometimes a movie isn't perfect, but it's everything it's trying to be, and I think that's the case here. Ferrel and Wahlberg are wonderful foils to each other, and Gibson and Lithgow play to their type very well. John Cena is better than he has any right to be. But the biggest props for me go to little Scarlett Estevez for her scene with the eggnog. (SPOILER) Most adults are terrible at acting drunk, let alone kids, yet she had us believing she was toast.","November 30, 2018",AnthonyWrites,Daddy's Home 2,4.0
"I rented this movie on ondemand the first day it came out. Being a fan of anything that Keanu Reeves is in I was anxiously awaiting this movie as I knew it would be a different kind of movie for him.  Mr. Reeves is a totally wonderful action star, but he is also a great actor when it comes to dark and psychological movies.  This movie lived up to my expectations.  This movie is a tragic love story between two people who are from different cultures and who have lives that they are trapped in. When they are thrown together because of a diamond deal gone awry, they develop a relationship that is both sensual, emotional and yes loving even though he is married and she is supposedly engaged.  They become entangled in the Russian mob about the diamond deal.  Then things get dicey.  The Russians don’t play and they put these two people in a violent situation that they try to escape from.  I thought the story was great.  The characters were well played by Keanu and Una and their chemistry worked.  They both exhibited great emotions throughout the movie.  Keanu’s command of the Russian language was perfect.  That in itself shows the work and passion he puts into every role he plays.  All I can say is if you’re not interested in seeing a well thought out and acted movie for mature people who appreciate the noir type of movie, then this movie is not for you.  Of course there are a lot of CGI movies out there to hold your attention without you having to invest yourself in a thought provoking movie. I already have the Blu-ray DVD.  Congratulations to all involved with this movie.  A job well done.","September 18, 2018",Gatorgirl,Siberia (2018),5.0
"I have seen ""Primal Fear"" at least four times and with each viewing I am still amazed at the superb performances by Richard Gere, Laura Linney and especially Edward Norton.  In fact, there are not enough superlatives to describe the performance by Edward Norton as Aaron/Roy.","June 17, 2018",Tullia,Primal Fear,5.0
"I've heard the term ""Indecent Proposal"" before but never had the chance to watch the film. I didn't even know it was adapted from a book. It was a great film but if I was the screenwriter and director, I'd had the sex scene with Moore and Redford included because the viewer could have compared Moore's passion between Redford and Harrelson and contrast both experiences.","October 11, 2017",Person Me,Indecent Proposal,4.0
I can't say enough in praise of this movie. It had to be difficult for both Jodie Foster and Kelly McGillis to endure the making this film. Kelly has endured sexual assault and Jodie was stalked and came out as lesbian at a time when it was difficult to do so.,"May 9, 2019",Meghan Kaur Louve,The Accused,5.0
"Excellent movie, great performance by Jennifer Lopez, Shea Whigham and Yolonda Ross plus one outstanding performance by Viola Davis. Well told story and I am now a fan of Ms Valerie June (who sang the outro). This was so good, I'm going watch it again. Probably get the DVD too.","July 20, 2015",Mase,Lila and Eve,5.0
It is exactly as advertised.,"August 1, 2013",Walter Marx,Soul Plane,3.0
"I absolutely can't stand movies like this, but as a woman we need a reminder of what could happen in the many chances we take in a sometimes stressful world where logical reasoning and confidence  compensates for the right decision in keeping us safe.  She also seem like a very nice person which sometimes leaves us with the disposition of trusting too easily. I was approached several times on the street and clubs by supposed women talent scouts in NYC commenting on how pretty I was with a natural look that would do well in modeling, but when I showed, person always requested money for a photo shoot which was a bit on the expensive side so never proceeded. If this happens to you and you're interested, just make sure you take friends with you and always let someone know where you're going. As someone once said, ""just cause you're paranoid doesn't mean they're not out to get you"".","April 13, 2019",Topaz,Apartment 407,5.0
Thank you for sharing on this platform .I enjoyed the simplicity of the the movie ! Great story !,"April 13, 2019",Bernida Kimble,Guava Island,5.0
"Excellent film. Sad that veterans come home wounded not only in body, but in mind. The struggle to ""fit in"" to society again. The love you have for family, but the wounds you carry, that make it hard to be ""normal"" by societiel standards.","October 3, 2018",James M. Cogdell,Leave No Trace,5.0
"I wouldn't call it a horror movie. The storyline is blah and I get it, killer lizards or reptiles that evolved? It doesn't make sense at all. It had some enjoyable elements but I wouldn't watch it again or pay for it.","June 1, 2019",Amazon Customer,Killers Within,3.0
"This movie could have been great.  But the whole Bill Murray scene was completely unnecessary, dragged out, wasted time, and didn't add to the movie.  It's almost like they realized the movie wouldn't be long enough to make it worthwhile, so they found someone to do a quick cameo that doesn't make sense, just to tack on a few extra minutes.","May 26, 2019",ssgtnelson,Zombieland,3.0
"This was a fun film. I am constantly annoyed at how inept dads and stepdads are portrayed in media, and this buys into it, but the jokes are funny. The situations are ridiculous but it is fun.","October 17, 2017",Big IV,Daddy's Home,4.0
"After the great reviews of this movie, I kept watching and waiting for the good stuff, but it never happened. I found this movie dull and depressing. Sorry I wasted my time watching it. Move along and find something better to watch.","May 13, 2019",catmusicgirl,Lost Fare,1.0
Ten minutes into the movie and here is why you should not rent it unless you're into films with low intelligence characters:,"December 1, 2018",Amazon Customer,The Domestics,1.0
"Hereditary is one of the new breed of horror movies. There aren't a lot of crescendoing music with jump scares, and the movie does not rely on gore, although there is some. What Hereditary represents is a leap forward for the genre. The performances here are stunning, with Toni Collette absolutely stealing the show. There is a particular scene of loss where her reaction is physically painful to watch.","December 30, 2018",TWL50,Hereditary (4K UHD),5.0
This much violence and sickness in this movie is beyond a cheap Gore movie and I believe this was not an entertainment but a torture of soul. This should not be allowed to be broadcasted. This is more like a snuff movie. remove this crap.,"April 9, 2019",Frank Tailor,All Hallow's Eve,1.0
This movie doesn't have a plot so much as it has a cover for a soft-core porno. After the 3rd graphic sex scene my wife asked me to turn it off and I was happy to oblige. It isn't like the plot was actually moving along anyway. There is a paper-thin veneer of suspense but the focus is mainly on Keanu Reeves and a Russian woman and their sordid and shallow sexual affair.,"November 29, 2018",I. M. Hagenbuch,Siberia (2018),2.0
A generic legal drama elevated by Gere and Norton.,"April 27, 2019",Matthew D'Souza,Primal Fear,4.0
"I saw this film when it came out and not liked it. I needed some background noise, so I watched it again, to see if I had a different opinion this time. No, I didn't. I was hoping for something more than a ridiculous romance drama, but that's what it is. I was hoping for a statement about materialism, which was in vogue in America since 1980. But it turned out to be about three noxious individuals whom I would have liked to have driven their car off that pier at the story's end.","May 18, 2019",Looking Closer,Indecent Proposal,1.0
"Jodie Foster is a fine actress. If anyone believes that to act, as in this filming is easy, try it.","April 3, 2019",LTC SHMUEL ROSENFELD,The Accused,5.0
"I absolutely loved this movie. I never even heard if it when it was released and just happened to find it on Amazon Prime. It was so good. Fast paced, very real characters, and relatable storyline. Viola Davis & Jennifer Lopez are great and convincing in each if their roles as grieving mothers who want to recover and satisfy their desire for revenge.","June 18, 2017",Bernadette G.,Lila and Eve,5.0
We had seen this movie before (very funny) and wanted this as a gift for friends.  Can not find anywhere else and happy to have found it on Amazon!  Funny.  If you like any of the Airplane Spoofs - you'll like this one!,"September 6, 2017",Grace,Soul Plane,5.0
"It is relatively easy to be skeptical about at least the details of the movie, since it does not quite fit with even the original story when it came out. The movie gives you the impression that the pace of violations were over several days, and indeed the time of captivity was alleged to be three days and two nights. However the impression one gets from the film is that this is a much longer period. The original story is that she was drugged right away on the second visit, not threatened with a knife and forced to drink the laced milk. The original story was she was raped by twelve men, or eight, or other numbers at different tellings until it settled in at eight. She escaped not by avoiding the fatal injection at the last minute by a phone call from her captor in the next room who had decided to off her himself then being knocked unconscious by the self-freed, handcuff-knuckled heroine. She escaped, she told authorities, because he had left the door unlocked. It also was in London, not anywhere in the United States.","April 8, 2019",Mike,Apartment 407,2.0
The movie was awesome. The music makes you feel like you want to get up and dance. Donald Glover is a force that ignites your soul in rhythm. Donald and Rihanna gave us that beautiful pure love that we all dream of....a love that makes your heart sing for no one but them. Sometimes we get love for a lifetime... but for others just a glimpse that will stay for a lifetime. I watched it twice back to back. Beautiful.,"April 13, 2019",TNR,Guava Island,5.0
"Ben Foster and Thomasin Mckenzie deliver compelling performances in a movie that has very little background music and minimal dialogue.  Their performances are both worthy of Oscar consideration.  The range of emotions displayed by both over a very emotive story line is an example of acting that is rarely seen today.  Equal measures sad over their respective struggles, and joyful over the obvious love of father and daughter, this is a movie that I highly recommend.","October 27, 2018",PCA,Leave No Trace,5.0
"Great plot twist with a great ""conspiracy theory"" imagination that some people might get turned off to but I liked it. The female lead was quite boring to me but the rest of the main characters were solid.","May 4, 2019",bruce brenners brother,Killers Within,4.0
"I felt the characters were really diverse and well done. Around top 5 compared to everything i've seen in that category. I feel the jokes are more ""hmph"" than ""lol"", but there are plenty and they are great. I feel this movie is a very big ""feel good"" movie, in that somehow the way all of the elements of the movie came together, it really felt me feeling nothing but positive emotion.","December 27, 2013",kyle cummings,Zombieland,4.0
"Maybe I was in the mood for garbage, but I thoroughly enjoyed it. While the original series was family friendly Scooby Doo storied smut, this was the opposite, meaning juvenile raunchy Scooby Doo storied smut. Despite the predictable story, and crude humor, it surprisingly had some original moments of intense action. Not realistic by any means, but not bad at all. There were some good laugh out loud moments as well, and plenty of bathing suit beauties. I'll likely never see it again, and be ashamed to recommend it, but I enjoyed watching it tonight.","May 14, 2018",Brian Butz,Baywatch,4.0
The story line makes you really makes me grateful for every day I'm alive.  This is a must see movie!,"May 10, 2019",Norma Lynn Hammett,Lost Fare,5.0
"I was afraid Tyler Hoechlin didn't have the chops for a role like this, but he's pretty much perfect as an estranged husband trying to save his marriage in post-apocalyptic America. Possibly too perfect - it's hard to understand why his wife no longer wants to be with him when he is willing to risk his life for her. Kate Bosworth as his wife will probably annoy you for about half the movie, but it's really all about her transformation from denial of the disintegration of America and her relationship to stepping up and taking responsibility for her life. Post-apocalyptic America is a lot of fun and appropriately full of cannibals, crazies and psychopaths. We really enjoyed this.","October 2, 2018",cr0wgrrl,The Domestics,4.0
Don t waste.your time with this movie. It makes no sense. It starts out well but then gets lost in a lot scary intended scenes  which Don t connect in the end  or have any logic to them.,"January 1, 2019",peace be with you,Hereditary (4K UHD),1.0
I gotta admit about halfway through the first story I was starting to think the movie wouldn't be fun to watch but I'd have to say the bad part of this movie only lasts about 5 minutes in my opinion. It's just that the first story has a few minutes of badly paced acting but it gets interesting before that story is over and the rest of the movie is actually pretty great.,"April 5, 2019",demonsRendangered,All Hallow's Eve,4.0
"I was so not enthralled with this movie. It bored me to death. I kept waiting for something interesting to happen. It never did. Keanu failed me in this movie. No action, no romance, and no intrigue. It was literally Siberia. Frozen and unapproachable.","September 1, 2018",Differently Driven,Siberia (2018),2.0
"For some reason, I have browsed right by this offering time and again....now I know why.  If you are film buff, it's a chance to see some favorite and really venerable actors in early roles - hamming it up, by comparison to their later performances.  Still, most of them have won top prizes lifelong for their commitment to playing the role fully at least.","April 26, 2019",Elle Shopper Lady,Primal Fear,3.0
"It takes a movie like this to remember how good an actor Woody Harrelson can be --and quite a leading actor, so handsome and tender. Pity that Hollywood has the tendency to typecast and they don't let him shine like he can. And why, oh why Hollywood doesn't do movies like this anymore?","February 24, 2017",path,Indecent Proposal,4.0
"This movie had my attention all the way through.  A must see, but be aware that the rape scene is gut wrenching.","May 11, 2019",zesty,The Accused,5.0
"This movie is a far cry from a cinematic masterpiece, but it did pose some thought provoking questions. The only reason I kept watching the movie was because of Viola Davis' performance as Lila. Jennifer Lopez as Eve wasn't awful, but her performance was a lacking, she had a great opportunity to shine. I think this movie had potential to develop a deeper plot and better character development, but it missed the mark. The ending, with the anticipation of a big twist fell short of living up to the hype.","August 26, 2015",Kate W,Lila and Eve,3.0
"... and virtually every gag in the film is based on the exploitation of stereotypes, thereby proving the value of stereotyping.","May 27, 2019",JayJay,Soul Plane,5.0
"to me how 'some' seem to think they know this womans story and what she went through. If you didn't live it, weren't there standing along side her, than, you have no clue. The thing is women are never believed but worse, 'other' women bashing them , calling them liars. Maybe there are parts of this movie made to be sensationalized but none the less, it's a tragic tale and one worth watching.","March 30, 2019",Mama Love,Apartment 407,3.0
"Acting was great. The story wasn't long, but because of that it was to the point. It starts off as a fable and ends like a modern day fable making it super relevant. Even if circumstances in your daily life aren't as dire there's something everyone can take from this story.","April 13, 2019",Dave,Guava Island,5.0
"This is an exceptionally well done movie illustrating challenges experienced within families of veterans with PTSD, in this film a father and daughter. It is well acted; has beautiful cinematography; and an unusual storyline. It has received many positive reviews and has been nominated for the Independent Film Spirit Awards for Best Film, Best Director, Best Supporting Actress. It has already received accolades at the New Hampshire Film Festival as well.","November 27, 2018",Sylvia,Leave No Trace,5.0
I like shows that don't make the actors stupid by doing things that any military or trained officer wouldn't do. Like a B rated cheerleader out in the woods movie it has the same kind of acting.,"June 2, 2019",lewis parker,Killers Within,2.0
"I think you would have to be an actual Zombie to rate this movie more than 1✫. Oh, for a moment I forgot that Zombies  aren't real, but lemmings are.","May 17, 2019",Betty,Zombieland,1.0
I have watch all the Madea movies. Tyler Perry does a great job writing the madea series.  I can't wait to see what madea movie he is coming up with. His Madea Halloween movies are funny.,"January 30, 2018",Erin S.,Tyler Perry's Boo! 2 A Madea Halloween,5.0
Made it to the 8:30 mark and turned it off. One of these stupid movies that takes itself oh-so-serious but is nothing but a pile of steaming dogsh*t.,"June 1, 2019",ancient_sediments,Lost Fare,1.0
If you partake in anything that enhanced your giggle factor and amazement at things that are only marginally amazing I suggest partaking before watching this. If you do this is worth a watch. If not your mileage may vary,"January 11, 2019",My Name,The Domestics,3.0
"Hereditary reminded me more or a European-styled horror film than one made in the US. It has a slower pace and doesn't rely on jump-scares to makes its points. Its got a decent plot, great acting and enough shocking imagery that'll stay with you long after the film is over.","December 30, 2018",JC,Hereditary (4K UHD),4.0
Do you like movies where the main characters sit down and watch a movie? Then this is the movie for you! Do you NOT want to watch a movie where 80% of the movie is people watching another movie? Then you will find this movie annoying as I did. Skip it.,"April 21, 2019",A. R.,All Hallow's Eve,2.0
"Wish I could give a -5 stars, what a waste of money.","August 19, 2018",Amazon Customer,Siberia (2018),1.0
This movie is all about outstanding performances by the three leads.,"November 14, 2015",Red,Primal Fear,5.0
"A lot has already been said about the flaws of this movie, and I have to agree: Demie Moore is wooden (but then again, I never considered her a good actress, although I do think that she is a stunning natural beauty); Robert Redford just a tad too old (again - love the guy AND the acting, but still...), but above all, the plot has holes, the dialogue is flat and the characters lack dimension.","January 10, 2009",Ana_y_lat,Indecent Proposal,4.0
Its not only an 80's classic but Jodie won the Oscar's for this role...I've been her fan ever since...the story line and direction is still very good even in this time and the subject of rape was taken very fairly but still needs tons of attention in terms of prosecution and jail terms that should be given a LIFETIME WITHOUT BAIL!!!! Period.,"June 1, 2019",Amazon Customer,The Accused,5.0
"Excellent movie that is thought provoking.  It makes you wonder what goes through the minds of mothers who lose their kids too early.  In this case, the mother, Lila, goes to a support group after her son was killed by a drive-by shooting.  While at the group, she met a friend, Eve, who she chooses to be her sponsor so that she can be supported to reach her goals.  Lila is able to relate with Eve because Eve seems to know what Lila is feeling and offers just the right advice to make her feel better each time.  However, is Eve really trying to help Lila or is Eve using Lila to satisfy her own craving for danger.  What you discover later in the movie will be a shock.  It's a smart movie and well directed.  The acting is quite good including J.Lo.  Nice job and great story telling.","September 15, 2017",nyc,Lila and Eve,4.0
My wife loves this movie but someone borrowed it permanently so I'm glad I found it here and replaced it for her. :-),"January 30, 2019",Darnell Jones,Soul Plane,5.0
This is a movie that people need to watch. There are master manipulators in this world who know all the right things to say to draw you in and earn your trust. So many children and women have either been kidnapped and forced or conned in sex slavery. It’s absolutely heart-wrenching to think about a child being abused in that way.,"April 10, 2019",Kdh,Apartment 407,3.0
Wow Amazon what's up with this crap.  Rihanna next to the real actors just makes her look even more ridiculous.  Her non acting is distracting.  Why is she here?  Window dressing? This garbage looks like it was made in the 70s.,"April 13, 2019",lorhop99,Guava Island,1.0
