comment,date,writer_name,movie_name,rating
"This movie was funny, i am not a Will Farrell fan in the least, (in fact i despise him) but i watched part 1 of this movie earlier on in the night and i just HAD to see part two.  it was hilarious.  Not only was Farrell tolerable he actually mad me laugh for a change, he totally changed his persona and was not the normal obnoxious actor he once was, Mark wahlberg put on a great display.  Lets just say i personally was impressed with the movie and i am a tough critic.","May 17, 2018",Robert Januchowski,Daddy's Home 2,5.0
"I think if one is not used to real quality writers...well orchestrated scenes...used to the quality that movies used to have..then a simple mind would be content w/this.  It seemed as tho' the writers were not committed to a well written play, had the feel of rushed to put together ""SOMETHING"" that could be put out before Christmas.  Mel Gibson playing a rebel rouser who acted much like a drunkekn sailor w/no real morals, Will Ferrel who is suppose to keep rolling on his past so called comedy conquest....John Lithgow always is an excellent performer....the kids were surrounded by bad parenting, they get intoxicated become foul mouthed...the little brother has a thing for his sister, albeit step sister, which is not known until the end when he kisses her. Then there is a line of young girls to get their kisses from him while standing under the mistle toe & then you see a small boy who is in line to kiss him which is more of the movie industry preying on children & twisting their minds. Earlier in the movie Ferrel stated he had a genderless flash cards in order to give the 8yrs old son the ""talk""...which is hellyweirds way of gender confusion goals. I didn't laugh once. This is NOT a family movie & would NEVER PERMIT ANY OF MY CHILDREN TO WATCH IT nor would I pay to rent it. I'm very surprised Mel Gibson would even accept such a raunchy part whose role was to be an absentee disapointing father figure. It has more of a feel that they  used the A List of Actors to sell this movie because the script itself could never sell it. If you want to waste time & don't care on what you waste your time then this would be the movie for that.  Just like the music of my era...young adults disapointed in todays generation of music...nothing original, nor creative...all sounds the same...back in the 60's, 70's & 80's great years in music & from the 40's, 50's, 60's, 70's & even the 80's were great years in movies.  Real wit, humor, orchestration....family movie's were family movies...there were no bad languages or horrors of remarks of genitals making a man or not....scripts took talent...being ingenious..I didn't laugh once thru out this movie, was glad it was over & don't want to ever endure anything like this again.  Flat out insulting. It would not have been hard to have made this into a really good family movie...if that would be the goal, but obviously wasn't the goal nor the intentions of this movie","November 23, 2018",Talara Masters,Daddy's Home 2,2.0
"Holy wow, I was really liking this movie, thought I'd play it for all the kids when they come for xmas, seems like a pretty well made kids xmas movie.. then 2/3 thru the movie they present guns right propaganda and handing a little kid a gun to kill an animal.  You can tell there's 2 right wingers in this movie (Mark Wahlberg and Mel Gibson).  I'm just flabbergasted they put this horrid scene into the movie.  There should be a WARNING about this propaganda before parents innocently have their kids exposed to this propaganda without them knowing what's in the movie.","November 22, 2018",CherryM,Daddy's Home 2,1.0
I love Zombieland. It is one of the few movies I think that understands how to have fun and be humorous while still treating the character relationships and development seriously.  It pokes fun at zombie movies without resorting to slapstick or stupid humor.,"January 18, 2018",Andrew Cooper,Zombieland,4.0
this was better than the first one i thought!! so funny!,"February 9, 2018",Barbara Brown,Daddy's Home 2,5.0
"I thought I was getting a zombie comedy movie, instead I got a boring teen romance movie with zombies in the background. One huge problem is there's never any sense of danger or urgency, so I wasn't invested emotionally with any of the characters. I didn't care if they lived or died or whether low rent Michael Cera clone Jesse Eisenberg would hook up with Emma Stone or whether Woody Harrelson ever finds a Twinkie. This movie is in fact one big Twinkie. It's too light and sugary for my taste and has zero nutritional value. Oh sure the movie looks good at first, but the comedy (and zombies) feel like tacked on accessories to a predictable and ultimately pandering Hollywood plot. The ""hero"" learns to engage with other humans and finds the family he's always been looking for including the girl of course. Woody Harrelson is just there for contrast and to help the ""hero"" on his journey. The one exception to the general tedium is a cameo by Bill Murray. Unfortunately his role is a small and all too brief one. You want a funny and original zombie movie? Watch Shaun Of The Dead. This one might be good to watch while folding laundry.","May 30, 2019",Chet Fakir,Zombieland,2.0
"Surprised  by laughter.  Both husband  and I  enjoyed  this.  I  don't  usually rate  movies but this  sequel  in seamless.  granted  it  was  typical  Christmas stuff,  But  most CHRISTMAS movies  are.  duh.  I thought  the  multiple  families  worked  very well together.  I  did not  think Mel  stole  the show  as  some  wanted  to say  in their  reviews.  We were falling  out  of  our  chairs  and  our cats  were  falling  out of  our  laps.  Hoping  for  number three.","March 5, 2018",J. L.,Daddy's Home 2,5.0
Then keep moving.,"March 31, 2018",Adonya,Soul Plane,5.0
"Frieda Ferrell the actress portrays herself in what she claims to be a true story.  However, it is not a true story.  Frieda Ferrell was a model before the alleged incident, not a Pilates instructor.  The alleged event happened in London, not the US.  She did not have a daughter.  She was allegedly held for three days.  After her alleged escape, she waited several days to contact the police and she never contacted her boyfriend at the time again.  The police apparently found her story implausible, although they did investigate.  Of course her alleged captor never apprehended.  The police have not corroborated her story or commented on the case.  While it is important to believe people when they report crimes, it is also important to require evidence and corroboration and not believe every story you hear, especially when the story is presented in a way that seems to be more for the purpose of advancing your career rather than stopping and punishing terrible crimes.  The movie itself is a piece of trash, even as a horror thriller, with no psychological tension.","February 20, 2019",Veronica L,Apartment 407,1.0
"In what seems like one of the most indie films of the year, Donald Glover and Rihanna take on a story of love, war, and everything in between. With cinematography that echoes City of God and a soundtrack that screams Gambino this movie will not disappoint. While the film as a whole could've definitely been longer it was nice to see a formulaic change and I for one am very excited to watch it again.","April 13, 2019",Everett Shirey,Guava Island,5.0
I will not tell you the plot as others have already done that with too much detail. I will offer my review of the movie and answer some of the criticisms of other reviewers.,"August 2, 2018",Kim Hoag,Leave No Trace,5.0
"They tried. They spent way too much time setting up a pointless crime angle and backstory about the effects on family when a ""good cop"" goes bad (or makes a career-ending stupid decision), and then they didn't really have enough story to fill the rest of the movie. So they dragged it out. They have a few good moments and some good lines, but it wasn't enough. It plods along, then gets interesting for a few minutes, and then it plods again, plods some more, and then wraps it all up with a nice little bow when the ""good guys"" win over the bad guys and the other, side story bad guys. -- Andrew Murray as Philip and the young man who played his son were the only two with any presence on screen. Technically, the prosthetic monster makeups were excellent. Those are what the movie had going for it. -- Some reviewers try to make hay out of the lunatic ""Lizard People"" global conspiracy theory, saying it's what makes the movie intelligent, erudite, clever, and all that. Bless'em. They're reaching. -- ""Killers Inside"" is pretty much standard fare B-horror, a creature feature using the typical vampire movie premise, and when it gets going it's really just a bug hunt. That said, there are a lot of way worse movies out there. -- Watch it if you have nothing better to do and/or need to pass the time... or you review movies. 4/10","May 2, 2019",M. TURNER,Killers Within,2.0
"A tad overrated in my humble opinion. Breslin and Stone are cute characters but Eisenburg is his usual nasal and annoying self and Woody is, well, Woody. Much of the humor didn't land for me and the zombie's were simply props in the film. Still, worth a watch if you aren't expecting the masterpiece the reviews seem to think this is.","May 11, 2019",Ron Baker,Zombieland,3.0
"As a mom of 2 teenagers & old enough to enjoy both the ""dad"" actors and the ""grandpa"" actors (and all the muscles, cuteness & comedy that comes with each of them) loved it.  At least 5 LOL moments throughout.  You must love Will Ferrel comedy or don't watch.  Little slapstick & silly, but I loved it. Nice mom night alone or Family night (although wouldn't let a kid under about 14 watch because of some conversation about ""the talk""...each to his/her own. :)","April 5, 2018",ALC Gardner,Daddy's Home 2,5.0
Soul Plane has to go down as one of the worst and dumbest movies of ALL time...which is why I love it so much! It's good 'bad' if you know what I mean...this is the type of movie that you put your brain in your pocket for an hour and a half and just enjoy the fun...that's all! You knew it wasn't Shakespeare when you stared watching it!,"June 5, 2017",Darryl Wren,Soul Plane,5.0
"Glad I saw this, and yes, we need to know, but frankly, I found this film to be more sensational than it needed to be. It dramatized the terrible things that happened to this unfortunate woman (and many more like her) in a manner that was a bit slick and pornographic for me. I'm not a prude and not anti-porn. I just think it could have been handled differently.","December 26, 2018",hawthorne wood,Apartment 407,3.0
Donald Glover shows us why he is the futuristic musical talent as he finds a new and innovative way to promote his album while incorporating the authentic and spiritual feel of the islands in his songs. The scenery of Guava Island is as refreshing as a morning sea breeze. The warmth and courtesy of the people shine through.,"April 13, 2019",Ricardo,Guava Island,3.0
"This is a hard movie to put into words.  But I was instantly engaged and soon I was all in.  Even when the father is not doing what most believe is in his daughter's best interest, he thinks he is.  There are no bad guys in this movie.  Just people interacting and helping in what way they can.  The young actress was extraordinary, but please don't let that take away from the amazing performances by all.  Movies like this make you feel.  Purchase more than well worth it.","October 6, 2018",Lisa C. Nelson,Leave No Trace,5.0
I love making furniture and when the mom brings dinner from stove top to right on top of the unprotected wood finish without hesitation shows this lady is areal winner meaning most people who understand craftsmanship and elbow grease cringe when some idiot burns the top of the kitchen table  or your wife's friend throws her big crappy bag on your cars paint job then slides it off so it scratches right across and when you say something she gets all butt hurt and your wife tells you say's your mean because you told the overweight always got something in her mouth eating diabetes having stretch pants wearing slob got a tank top on and a mouse tattoo on her neck dang sorry to rant I get upset when stuff get ruined I guess......HAHAHAHAHAHAHAHAPUT THE POT ON A COASTER DUMMY!,"May 7, 2019",wylie,Killers Within,3.0
"This movie has everything. Sarcasm, zombies, and Bill Murray, with clown death as an added bonus. Boy do I hate clowns. Watched it with my son, who is finally old enough to watch this kind of thing. Even funnier than I remember.","January 7, 2018",AEH,Zombieland,5.0
"I LAUGHED SO HARD SO MANY TIMES. Great movie! And so cute. Would love to see the development of John Cena's and Mark Wahlberg's relationship under the influence of Will Ferrell's character as well as the friendship between the Mel Gibson and John Lithgow characters- would be super hilarious. Would be super funny if Mel Gibson and John Lithgow's characters became roommates in a future Daddy's Home movie. Hope to see Daddy's Home 3, Daddy's Home 4, Daddy's Home 5, etc.","August 2, 2018",MK,Daddy's Home 2,5.0
FORMAT: Blu-Ray,"May 22, 2017",ChicGeek,Primal Fear,5.0
I'm amused to see 3 and 4 star ratings from people who've watched it multiple times.,"October 30, 2017","Thomas G. Field, Jr.",Indecent Proposal,5.0
Excellent movie. There’s a moment at the end that gets pretty in detail but the story line is very effective. It show how the justice system tends to take the easy way out and how that can affect the victim. The 2 lead actresses were excellent together and I feel like this is a great movie that brings awareness to more than one major issue.,"October 30, 2018",Jo Simon,The Accused,5.0
"I thought this was a very good movie!  On the surface of the story is a woman who suffers a sudden devastating loss of a child and the subtext was the mental and emotional break she experiences due to an act of senseless violence.  I thought the subplot of mental illness was clever and added a twist to the story that I never saw coming.  Another underlining coincidence was the use of the name ""Eve;"" according to biblical reference, the first Mother to experience the murder of her child, Abel, by his brother, Cain.  This movie is worth watching.","February 11, 2019",L. Foster,Lila and Eve,5.0
"Have to give credit  where credit is due!  Soul Plane has creativity, comedy and a little runch! I love connecting the dots. Alot actors or jokes I may not have picked up on when I was younger. Golly O' Molly I got it now! If you consider this movie to hood. It makes number one under the Hood Genre.","April 10, 2019",Jasmine S.,Soul Plane,5.0
This is a movie that people need to watch. There are master manipulators in this world who know all the right things to say to draw you in and earn your trust. So many children and women have either been kidnapped and forced or conned in sex slavery. It’s absolutely heart-wrenching to think about a child being abused in that way.,"April 10, 2019",Kdh,Apartment 407,3.0
"Bite the hand that feeds you is the socialist motto of this film. While deeming capitalism and comparing US capitalism to totalitarianism capitalism, this film is trying to fit the narrative to socialize the US while also telling those of small countries or small island groups to look away from capitalism and stay within your tradition. I do agree with the latter, but it is nearly a fantasy that is ignorant to the expansion and evolution on an 'intelligent' or industrialized civilisation. I am not saying that I disagree with all of CG's messages, but only stating an observation of the ill ideology popularized fad on the internet. It's hard to watch CG talk about socialising the island while he enjoys the fruits of modern technology, parading around all high and mighty on his moral high ground blessed by the people around him. It's hard to like this movie when he demonises the US while comparing it to a full work week controlled by a totalitarian dictator of which we do not have.","April 13, 2019",Tumitime,Guava Island,1.0
Films should tell a story and move the viewer emotionally.  This film does that.  The backdrop is beautiful and the dialogue is no more than what's needed.  Definitely worth the watch.  A film that will be on your mind for days after watching it.,"October 3, 2018",Jack Bean,Leave No Trace,5.0
"I agree with everything said in Leon's review, and I suggest you read it first. Minimal background/plot spoilers.","April 5, 2019",Anna,Killers Within,5.0
I decided I wanted to build up a movie collection of my favorite movies. Zombieland is my all time fav zombie movie.,"July 10, 2018",rooben,Zombieland,5.0
Laughed the whole,"February 13, 2018",Amazon Customer,Daddy's Home 2,5.0
"Primal Fear may very well put the fear of something in you. It could be weirdest movie this side of American Beauty. Richard Gere is tasked with defending an alter boy accused of murdering a beloved Chicago priest. Gere is the flamboyant win at all costs, anything to get client off who meets his match in the Edward Norton character. But before we get to that point, the attorney has to figure out how to get his client off while waging something of a war against two very powerful institutions the Catholic Church and the Chicago PD. While this struggle is intense, it’s only half the battle.","December 29, 2015",Michael Griswold,Primal Fear,5.0
"The movie is an okay, kind of cheesy, drama/romance.  It stars Demi Moore, who in 1993 was in her prime as an actress and physically being absolutely gorgeous (not that she is bad now), Woody Harrleson who was probably at the height of his popularity coming off of Cheers, and Robert Redford who was probably on the other side of his leading man status, which actually worked well for the role he played. The story is simple, a young couple in financial trouble decides to go to Vegas (of all places) to try to turn a little bit of money into enough to get out of debt.  Redford, who is a billionaire playboy sees Demi Moore tries to hit on her, and when he discovers she is Married offers the couple a million dollars for one night with her.","November 10, 2015",Mike S.,Indecent Proposal,4.0
"I gave this movie 5 stars because I truly believe Jodie Foster and Kelly McGillis did a great job or portraying a rape victim and a prosecutor. This is based on a true story. The person in the movie was not the victim but this really happened. I can not even imagine going through something like this and having people cheering this on. To me, that room and atmosphere was filled with the worst sort of perversion. Rape is not just a sexual crime, it is a violent, aggressive act against another human. It is force, and bullying and a disconnected crime with the inability to express self-control and compassion for the victim. I am very thankful that because of a very brave young woman, laws were changed. There is still a lot of work to be done for rape victims and the offenders to not only bring them to justice but a great deal to be done to prevent these crimes. I learned a few things from this portrayal. I am very aware that if one is not in the room or present during the crime, it is a great challenge for them to imagine and get upset enough to persecute or put forth a vote of guilty. That is why it takes very brave people to tell the whole story. This movie was very good for teaching. It is a good study of human behavior. I am glad I viewed it again. I wonder if the rape scene will haunt the male actors. It was very graphic and maybe at that time, it was a shock to many viewers. I myself could not have watched this in a movie theatre. I saw it on cable years ago in the privacy of my home and now again streaming. My heart went out to the victim. It is not in me to shame a victim. It does not matter that she was drinking, flirting or dancing seductively. That is a part of who she was and a choice she got to make. The actual aggressive act was about the offenders and God help us if we, as a society fall asleep and allow this crime to go unpunished. It matters! It matters for the weaker in our society. And at that moment, she was weak. These men were predators and anyone could be a victim. She walked right into their lair. The statistics given at the end of the movie tell me, a viewer that this movie was not some crap piece taking advantage but an effort to educate the public. I recommend this movie for young men to view. I do not recommend for young children or female teens as I am sure it would be emotionally disturbing but maybe it would prevent someone from thinking it is okay to get drunk at a bar. In those situations anything can happen. A theft, a rape, a murder, a bar fight, a car accident. We all know better. Good job people. Good effort.","May 22, 2019",Ladybug52,The Accused,5.0
"Viola Davis is a phenomenal actress. With that being said, an actress as strong as she is does NOT need antics like a ghost or hallucination in the form a real person. WTF??? Lila & Eve would have been so much better without casting Jennifer Lopez as the ghost/hallucination. This movie reminded me of Peppermint where Jennifer Garner took down an entire cartel........BY HERSELF! I love movies where women kick a$$ and get revenge. I just wish that more writers and directors would write and produce decent scripts without all the foolishness and without writing crappy stories that have been done a million times before. And this is no diss to Jennifer Lopez, she's not a bad actress at all, but she just did not fit well with this movie. Plus, she sounded weird with the slang dialect and trying not to speak with her accent. Jennifer is better at romantic comedies and pretending she can sing! LOL!","March 14, 2019",Miss Nickie,Lila and Eve,3.0
"So, how do you make ""Guava Island"" look good?  Just compare it to Soul Plane which is so bad that it has audiences scrambling for just about anything to enjoy.  Bad acting, weak cameos, cheap thrills and the oh-so-NOT-funny Kevin Hart.  This is cheap entertainment, nothing more.","April 25, 2019",True-Review,Soul Plane,1.0
There is a review on here (Amazon) that denigrates the woman portrayed in this movie. Movies often change certain facts and waiting before you go to the Police should never be held against a victim.  My GOD!  One should do whatever they can to survive.  The movie is worth 4 stars for being informational at the very least.,"March 29, 2019",Shakti Skye,Apartment 407,4.0
"I'd say people naturally associate songs with certain people or moments in their lives.  It creates powerful emotions and vivid images whenever they hear that song. Guava Island is like watching that process play out in real time. You see the second when a song becomes something more. It transforms into a person, a moment or a memory.....Every word and beat gains a deeper meaning.  The way they were able to blend the storyline with the music was just amazing. Its also a reminder that everything is temporary. We have try live in and enjoy the present moment while we can.","April 13, 2019",KenG,Guava Island,5.0
"This was a very sad, but restrained story of the effects of war on those who were in it, and their families.  It's also a story of loving and caring strangers  and how much they can help those in need.","October 2, 2018",Sandy W,Leave No Trace,5.0
"Went into this one not having seen the trailer or knowing more than what the Amazon Prime description said, what I got was a nifty little Irish independent home-invasion horror thriller. It's flawed to be sure, yet is still watchable. I'd be extremely interested in what they could do with a bigger budget.","May 10, 2019",MoviemanKev,Killers Within,3.0
I used this film for training ideas for the Apocalypse.  I am truly ready.  I double tap everything now.  Two staples on every document.  Two Styrofoam cups at the coffee machine.  Two emails sent to everyone of MY FREAKIN great IDEAS.  Two copies of every print out.  Two trash cans because I get a lots of extra copies returned to me because those pencil necks have no clue.  Work is going to be so awesome on that day.  It was good movie. I enjoyed it.  I thought Bill Murray was in it.  did I miss the scene or was he removed.  Maybe he was afraid of some freakin nut with some great ideas.  Excellent comedy  enjoyed it,"May 3, 2015",annonymous,Zombieland,5.0
"Funny movie, but full of liberal garbage. All throughout this movie, the producer was pushing his own liberal agenda. Also, this is not a family movie. The children were horrible and a terrible example to any child whose parents are dumb enough to let them watch it. I'm rating this a one star because of the immorality that abounds throughout the entire movie and the gross liberal content.","November 16, 2018",Rebecca,Daddy's Home 2,1.0
"First, I was born, educated and have lived my entire life in Moscow.  I want everyone reading this to know that Russians are not living in the 19th century now. Everyone uses modern gadgets, unlike Katya's home in Myrniy!!!  Another big stereotype used was showing everybody drinking vodka, however, the cafe scenes showed the men drinking something else without any food.  If Russians drink vodka, there are always copious amounts of food on the table. The director needed to utilize Google and find out about the real Russian brands of vodka consumed in Russia. In  addition, in Siberia not everyone speaks English. Plus, the ramshackle country home at which Pyotr's body was found had a door with large gaps between boards... this is Siberia!!!!!!!!!!!  And the Federal agents (always professional in any country) would have never been identifiable in the hotel lobby.","December 2, 2018",NikaVictoria,Siberia (2018),1.0
